{
  "chain_id": "evaporchain-staging",
  "genesis_time": "2026-04-01T00:00:00Z",
  "consensus": {
    "type": "tendermint",
    "block_interval_ms": 1000,
    "grace_period": 5,
    "max_rounds_per_height": 10
  },
  "validators": [
    {
      "id": 0,
      "name": "staging-validator-0",
      "stake": 10000,
      "address": "0x01",
      "p2p_address": "/ip4/0.0.0.0/tcp/26656"
    },
    {
      "id": 1,
      "name": "staging-validator-1",
      "stake": 10000,
      "address": "0x02",
      "p2p_address": "/ip4/0.0.0.0/tcp/26657"
    },
    {
      "id": 2,
      "name": "staging-validator-2",
      "stake": 10000,
      "address": "0x03",
      "p2p_address": "/ip4/0.0.0.0/tcp/26658"
    }
  ],
  "bootstrap_peers": [],
  "accounts": [
    { "address": "0xa1b2c3d4e5f6a1b2c3d4e5f6a1b2c3d4e5f6a1b2c3d4e5f6a1b2c3d4e5f6a1b2", "balance": 1000000, "label": "Foundation" },
    { "address": "0xb2c3d4e5f6a1b2c3d4e5f6a1b2c3d4e5f6a1b2c3d4e5f6a1b2c3d4e5f6a1b2c3", "balance": 500000, "label": "Core Dev" },
    { "address": "0xe5f6a1b2c3d4e5f6a1b2c3d4e5f6a1b2c3d4e5f6a1b2c3d4e5f6a1b2c3d4e5f6", "balance": 250000, "label": "Test Faucet" }
  ]
}
